word_name,meaning_hindi,meaning_english,example
Knowledge,ज्ञान,"Information, understanding, or skill acquired through experience or education",Knowledge is power when applied wisely.
Wisdom,बुद्धि,"The quality of having experience, knowledge, and good judgment",With age comes wisdom and understanding.
Learning,सीखना,"The acquisition of knowledge or skills through study, experience, or teaching",Continuous learning is essential for growth.
Education,शिक्षा,The process of receiving or giving systematic instruction,Education opens doors to opportunities.
Dictionary,शब्दकोश,A book or electronic resource that lists words in alphabetical order,A dictionary helps you understand new words.
Language,भाषा,A system of communication used by a particular community,Learning a new language broadens your horizons.
Vocabulary,शब्दावली,The body of words used in a particular language,Building vocabulary improves communication skills.
Practice,अभ्यास,The actual application or use of an idea or method,Practice makes perfect in any skill.
Success,सफलता,The accomplishment of an aim or purpose,Hard work leads to success.
Goal,लक्ष्य,The object of a person's ambition or effort,Setting clear goals helps achieve success.
